,chamber,congress,eventId,updateDate,url,committees,date,title,witnesses
519,Senate,118,335013,2023-11-20T21:11:54Z,https://api.congress.gov/v3/committee-meeting/118/senate/335013?format=json,"[{'name': 'Senate Energy and Natural Resources', 'systemCode': 'sseg00', 'url': 'https://api.congress.gov/v3/committee/senate/sseg00?format=json'}]",2023-10-26T13:30:00Z,Hearings to examine Federal offshore energy strategy and policies.,none
520,Senate,118,334998,2023-11-20T21:11:54Z,https://api.congress.gov/v3/committee-meeting/118/senate/334998?format=json,"[{'name': 'Senate Judiciary', 'systemCode': 'ssju00', 'url': 'https://api.congress.gov/v3/committee/senate/ssju00?format=json'}]",2023-10-26T14:00:00Z,"Business meeting to consider subcommittee assignments, and the nominations of Mustafa Taher Kasubhai, to be United States District Judge for the District of Oregon, John A. Kazen, to be United States District Judge for the Southern District of Texas, Eumi K. Lee, to be United States District Judge for the Northern District of California, Shanlyn A.S. Park, and Micah W.J. Smith, both to be a United States District Judge for the District of Hawaii, and Jamel Semper, to be United States District Judge for the District of New Jersey.",none
521,Senate,118,335014,2023-11-20T21:11:54Z,https://api.congress.gov/v3/committee-meeting/118/senate/335014?format=json,"[{'name': 'Senate Aging (Special)', 'systemCode': 'spag00', 'url': 'https://api.congress.gov/v3/committee/senate/spag00?format=json'}]",2023-10-26T14:00:00Z,"Hearings to examine access to therapies for people with rare, progressive, and serious diseases.",none
522,Senate,118,335020,2023-11-20T21:11:54Z,https://api.congress.gov/v3/committee-meeting/118/senate/335020?format=json,"[{'name': 'Senate Banking, Housing, and Urban Affairs', 'systemCode': 'ssbk00', 'url': 'https://api.congress.gov/v3/committee/senate/ssbk00?format=json'}]",2023-10-26T14:00:00Z,"Hearings to examine combating the networks of illicit finance and terrorism, including S.3049, to freeze $6,000,000,000 of Iranian funds held in Qatar, S.2355, to clarify the applicability of sanctions and antimoney laundering compliance obligations to United States persons in the decentralized finance technology sector and virtual currency kiosk operators, S.2281, to provide for consumer protection and responsible financial innovation, to bring crypto assets within the regulatory perimeter, and S.2669, to require the Financial Crimes Enforcement Network to issue guidance on digital assets.",none
523,Senate,118,335008,2023-11-20T21:11:54Z,https://api.congress.gov/v3/committee-meeting/118/senate/335008?format=json,"[{'systemCode': 'ssfr01', 'url': 'https://api.congress.gov/v3/committee/senate/ssfr01?format=json'}]",2023-10-25T18:30:00Z,Hearings to examine the Department of State's strategy for security in the Black Sea region.,none
524,Senate,118,335001,2023-11-20T21:11:53Z,https://api.congress.gov/v3/committee-meeting/118/senate/335001?format=json,"[{'name': 'Senate Foreign Relations', 'systemCode': 'ssfr00', 'url': 'https://api.congress.gov/v3/committee/senate/ssfr00?format=json'}]",2023-10-24T14:00:00Z,"Hearings to examine instability in the Sahel and West Africa, focusing on implications for U.S. policy.",none
525,Senate,118,335004,2023-11-20T21:11:53Z,https://api.congress.gov/v3/committee-meeting/118/senate/335004?format=json,"[{'name': 'Senate Health, Education, Labor, and Pensions', 'systemCode': 'sshr00', 'url': 'https://api.congress.gov/v3/committee/senate/sshr00?format=json'}]",2023-10-25T14:00:00Z,"Business meeting to consider the nominations of Monica M. Bertagnolli, of Massachusetts, to be Director of the National Institutes of Health, Department of Health and Human Services, Charlotte A. Burrows, of the District of Columbia, to be a Member of the Equal Employment Opportunity Commission, Erika L. McEntarfer, of the District of Columbia, to be Commissioner of Labor Statistics, Department of Labor, Amanda Wood Laihow, of Maine, to be a Member of Occupational Safety and Health Review Commission, and other pending calendar business.",none
526,Senate,118,335007,2023-11-20T21:11:53Z,https://api.congress.gov/v3/committee-meeting/118/senate/335007?format=json,"[{'name': 'Senate Finance', 'systemCode': 'ssfi00', 'url': 'https://api.congress.gov/v3/committee/senate/ssfi00?format=json'}]",2023-10-25T14:00:00Z,"Hearings to examine paid leave, focusing on policy, practice, and impact on the workforce.",none
527,Senate,118,335009,2023-11-20T21:11:53Z,https://api.congress.gov/v3/committee-meeting/118/senate/335009?format=json,"[{'name': 'Senate Budget', 'systemCode': 'ssbu00', 'url': 'https://api.congress.gov/v3/committee/senate/ssbu00?format=json'}]",2023-10-25T14:00:00Z,Hearings to examine how climate change threatens supply chains.,none
528,Senate,118,334988,2023-11-20T21:11:53Z,https://api.congress.gov/v3/committee-meeting/118/senate/334988?format=json,"[{'name': 'Senate Energy and Natural Resources', 'systemCode': 'sseg00', 'url': 'https://api.congress.gov/v3/committee/senate/sseg00?format=json'}]",2023-10-19T14:00:00Z,Hearings to examine the Department of Energy's due diligence process for awarding competitive grants and loans funded through the Inflation Reduction Act and the bipartisan Infrastructure Law and the Department's overall innovation investment strategy.,none
529,Senate,118,335051,2023-11-20T21:11:53Z,https://api.congress.gov/v3/committee-meeting/118/senate/335051?format=json,"[{'name': 'Senate Intelligence (Select)', 'systemCode': 'slin00', 'url': 'https://api.congress.gov/v3/committee/senate/slin00?format=json'}]",2023-10-24T18:30:00Z,To receive a closed briefing on certain intelligence matters.,none
530,Senate,118,335010,2023-11-20T21:11:53Z,https://api.congress.gov/v3/committee-meeting/118/senate/335010?format=json,"[{'name': 'Senate Judiciary', 'systemCode': 'ssju00', 'url': 'https://api.congress.gov/v3/committee/senate/ssju00?format=json'}]",2023-10-25T14:00:00Z,Hearings to examine ensuring the safety and well-being of unaccompanied children.,none
531,Senate,118,334996,2023-11-20T21:11:53Z,https://api.congress.gov/v3/committee-meeting/118/senate/334996?format=json,"[{'systemCode': 'sseg03', 'url': 'https://api.congress.gov/v3/committee/senate/sseg03?format=json'}]",2023-10-25T18:30:00Z,"Hearings to examine S.175, to codify certain public land orders relating to the revocation of certain withdrawals of public land in the State of Alaska, S.297, to amend the Federal Land Policy and Management Act of 1976 to authorize certain construction activities on public lands, S.1348, to redesignate land within certain wilderness study areas in the State of Wyoming, S.1719, to amend the Healthy Forests Restoration Act of 2003 to establish emergency fireshed management areas, S.1764, to improve Federal activities relating to wildfires, S.1889, to provide for the recognition of certain Alaska Native communities and the settlement of certain claims under the Alaska Native Claims Settlement Act, S.2132, to require the Secretary of Agriculture to establish a pilot program for the establishment and use of a pre-fire-suppression stand density index, S.2151, to amend the Southwest Forest Health and Wildlife Prevention Act of 2004 to require the establishment of an additional Institute under that Act, S.2581, to extend the Secure Rural Schools and Community Self-Determination Act of 2000, S.2615, to amend the Alaska Native Claims Settlement Act to provide that Village Corporations shall not be required to convey land in trust to the State of Alaska for the establishment of Municipal Corporations, S.2855, to modernize and streamline the permitting process for broadband infrastructure on Federal land, S.2867, to address the forest health crisis on the National Forest System and public lands, S.2991, to improve revegetation and carbon sequestration activities in the United States, S.3033, to withdraw certain Federal land in the Pecos Watershed area of the State of New Mexico from mineral entry, S.3036, to require the Secretary of the Interior to convey to the State of Utah certain Federal land under the administrative jurisdiction of the Bureau of Land Management within the boundaries of Camp Williams, Utah, S.3044, to redesignate the Mount Evans Wilderness as the ""Mount Blue Sky Wilderness"", S.3045, to provide for the transfer of administrative jurisdiction over certain Federal land in the State of California, S.3046, to make permanent the authority to collect Shasta-Trinity National Forest marina fees, H.R.3324, to extend the authority to collect Shasta-Trinity Marina fees through fiscal year 2029, S.3062, to provide for the removal of small-diameter trees in fire hazard areas, and S.3079, to establish a policy regarding appraisal and valuation services for real property for a transaction over which the Secretary of the Interior has jurisdiction.",none
532,Senate,118,335006,2023-11-20T21:11:53Z,https://api.congress.gov/v3/committee-meeting/118/senate/335006?format=json,"[{'name': 'Senate Homeland Security and Governmental Affairs', 'systemCode': 'ssga00', 'url': 'https://api.congress.gov/v3/committee/senate/ssga00?format=json'}]",2023-10-25T14:30:00Z,"Business meeting to consider S.2685, to make data and internal guidance on excess personal property publicly available, S.2866, to improve the customer experience of the Federal Government, ensure that Federal services are simple, seamless, and secure, S.3029, to amend title 5, United States Code, to increase death gratuities and funeral allowances for Federal employees, S.2150, to establish an Interagency Council on Service to promote and strengthen opportunities for military service, national service, and public service for all people of the United States, S.2087, to reauthorize the Congressional Award Act, S.2414, to require agencies with working dog programs to implement the recommendations of the Government Accountability Office relating to the health and welfare of working dogs, S.1258, to require the Director of the Office of Management and Budget to submit to Congress an annual report on projects that are over budget and behind schedule, S.3071, to amend section 324 of the Robert T. Stafford Disaster Relief and Emergency Assistance Act to incentivize States, Indian Tribes, and Territories to close disaster recovery projects by authorizing the use of excess funds for management costs for other disaster recovery projects, and S.3067, to require the Administrator of the Federal Emergency Management Agency to conduct an evaluation and submit to Congress a report on ways to reduce the complexity of the cost effectiveness requirements for hazard mitigation assistance.",none
533,Senate,118,335011,2023-11-20T21:11:53Z,https://api.congress.gov/v3/committee-meeting/118/senate/335011?format=json,"[{'name': 'Senate Foreign Relations', 'systemCode': 'ssfr00', 'url': 'https://api.congress.gov/v3/committee/senate/ssfr00?format=json'}]",2023-10-25T14:00:00Z,"Business meeting to consider the nominations of Jacob J. Lew, of New York, to be Ambassador to the State of Israel, Richard H. Riley IV, of California, to be Ambassador to the Federal Republic of Somalia, Mark Toner, of Pennsylvania, to be Ambassador to the Republic of Liberia, and Herro Mustafa Garg, of California, to be Ambassador to the Arab Republic of Egypt, all of the Department of State, Paul K. Martin, of Maryland, to be Inspector General, United States Agency for International Development, David E. White, Jr., of New York, to be Deputy Director of the Peace Corps, routine lists in the Foreign Service, and other pending nominations.",none
534,Senate,118,334922,2023-11-20T21:11:53Z,https://api.congress.gov/v3/committee-meeting/118/senate/334922?format=json,"[{'systemCode': 'sscm34', 'url': 'https://api.congress.gov/v3/committee/senate/sscm34?format=json'}]",2023-10-24T14:00:00Z,Hearings to examine protecting Americans from robocalls.,none
535,Senate,118,335002,2023-11-20T21:11:53Z,https://api.congress.gov/v3/committee-meeting/118/senate/335002?format=json,"[{'systemCode': 'ssju01', 'url': 'https://api.congress.gov/v3/committee/senate/ssju01?format=json'}]",2023-10-24T18:30:00Z,Hearings to examine competition and consumer rights in housing markets.,none
536,Senate,118,335003,2023-11-20T21:11:53Z,https://api.congress.gov/v3/committee-meeting/118/senate/335003?format=json,"[{'name': 'Senate Caucus on International Narcotics Control', 'systemCode': 'scnc00', 'url': 'https://api.congress.gov/v3/committee/senate/scnc00?format=json'}]",2023-10-24T19:00:00Z,"Hearings to examine the precursor pipeline, focusing on techniques that drug cartels use to procure and finance precursor chemicals that are used to manufacture illicit synthetic drugs, and actions the Federal government can take to address this issue.",none
537,Senate,118,335017,2023-11-20T21:11:53Z,https://api.congress.gov/v3/committee-meeting/118/senate/335017?format=json,"[{'name': 'Senate Indian Affairs', 'systemCode': 'slia00', 'url': 'https://api.congress.gov/v3/committee/senate/slia00?format=json'}]",2023-10-25T18:00:00Z,Hearings to examine implementing the Bipartisan Infrastructure Law and the Inflation Reduction Act in native communities.,none
538,Senate,118,334991,2023-11-20T21:11:52Z,https://api.congress.gov/v3/committee-meeting/118/senate/334991?format=json,"[{'name': 'Senate Armed Services', 'systemCode': 'ssas00', 'url': 'https://api.congress.gov/v3/committee/senate/ssas00?format=json'}]",2023-10-19T13:30:00Z,Hearings to examine the findings of the Congressional Commission on the Strategic Posture of the United States; to be immediately followed by a closed session in SVC-217.,none
539,Senate,118,334960,2023-11-20T21:11:52Z,https://api.congress.gov/v3/committee-meeting/118/senate/334960?format=json,"[{'name': 'Senate Foreign Relations', 'systemCode': 'ssfr00', 'url': 'https://api.congress.gov/v3/committee/senate/ssfr00?format=json'}]",2023-10-18T14:30:00Z,"Hearings to examine the nomination of Jacob J. Lew, of New York, to be Ambassador to the State of Israel, Department of State.",none
540,Senate,118,334989,2023-11-20T21:11:52Z,https://api.congress.gov/v3/committee-meeting/118/senate/334989?format=json,"[{'name': 'Senate Budget', 'systemCode': 'ssbu00', 'url': 'https://api.congress.gov/v3/committee/senate/ssbu00?format=json'}]",2023-10-18T14:00:00Z,"Hearings to examine achieving health care efficiency, focusing on improving care and lowering costs.",none
541,Senate,118,334961,2023-11-20T21:11:52Z,https://api.congress.gov/v3/committee-meeting/118/senate/334961?format=json,"[{'name': 'Senate Judiciary', 'systemCode': 'ssju00', 'url': 'https://api.congress.gov/v3/committee/senate/ssju00?format=json'}]",2023-10-17T14:00:00Z,"Hearings to examine the future of college sports, focusing on name, image, and likeness.",none
542,Senate,118,334981,2023-11-20T21:11:52Z,https://api.congress.gov/v3/committee-meeting/118/senate/334981?format=json,"[{'systemCode': 'ssbk09', 'url': 'https://api.congress.gov/v3/committee/senate/ssbk09?format=json'}]",2023-10-17T18:30:00Z,"Hearings to examine community development financial institutions and promotion of housing and economic opportunity, including S.869, to amend the Community Development Banking and Financial Institutions Act of 1994 to reauthorize and improve the community development financial institutions bond guarantee program.",none
543,Senate,118,334980,2023-11-20T21:11:52Z,https://api.congress.gov/v3/committee-meeting/118/senate/334980?format=json,"[{'name': 'Senate Environment and Public Works', 'systemCode': 'ssev00', 'url': 'https://api.congress.gov/v3/committee/senate/ssev00?format=json'}]",2023-10-18T14:00:00Z,Hearings to examine the implications of <em>Sackett v. U.S. Environmental Protection Agency</em> for Clean Water Act protections of wetlands and streams.,none
544,Senate,118,334984,2023-11-20T21:11:52Z,https://api.congress.gov/v3/committee-meeting/118/senate/334984?format=json,"[{'name': 'Senate Finance', 'systemCode': 'ssfi00', 'url': 'https://api.congress.gov/v3/committee/senate/ssfi00?format=json'}]",2023-10-18T14:00:00Z,"Hearings to examine Medicare Advantage annual enrollment, focusing on cracking down on deceptive practices and improving senior experiences.",none
545,Senate,118,334982,2023-11-20T21:11:52Z,https://api.congress.gov/v3/committee-meeting/118/senate/334982?format=json,"[{'name': 'Senate Health, Education, Labor, and Pensions', 'systemCode': 'sshr00', 'url': 'https://api.congress.gov/v3/committee/senate/sshr00?format=json'}]",2023-10-18T14:00:00Z,"Hearings to examine the nomination of Monica M. Bertagnolli, of Massachusetts, to be Director of the National Institutes of Health, Department of Health and Human Services.",none
546,Senate,118,334994,2023-11-20T21:11:52Z,https://api.congress.gov/v3/committee-meeting/118/senate/334994?format=json,"[{'systemCode': 'sscm37', 'url': 'https://api.congress.gov/v3/committee/senate/sscm37?format=json'}]",2023-10-18T18:00:00Z,"Hearings to examine promoting safety, innovation, and competitiveness in U.S. commercial human space activities.",none
547,Senate,118,334990,2023-11-20T21:11:52Z,https://api.congress.gov/v3/committee-meeting/118/senate/334990?format=json,"[{'systemCode': 'ssju04', 'url': 'https://api.congress.gov/v3/committee/senate/ssju04?format=json'}]",2023-10-18T14:00:00Z,"Hearings to examine the nation's immigration courts, focusing on preserving due process and the rule of law.",none
548,Senate,118,334992,2023-11-20T21:11:52Z,https://api.congress.gov/v3/committee-meeting/118/senate/334992?format=json,"[{'name': 'Senate Banking, Housing, and Urban Affairs', 'systemCode': 'ssbk00', 'url': 'https://api.congress.gov/v3/committee/senate/ssbk00?format=json'}]",2023-10-19T14:00:00Z,"Hearings to examine the nominations of Tanya F. Otsuka, of Virginia, to be a Member of the National Credit Union Administration Board, Mark Toshiro Uyeda, of California, to be a Member of the Securities and Exchange Commission, Spencer Bachus III, of Alabama, to be a Member of the Board of Directors of the Export-Import Bank of the United States, Jennifer L. Fain, of Virginia, to be Inspector General, Federal Deposit Insurance Corporation, and Claudia Slacik, of New York, and William Brodsky, of Illinois, both to be a Director of the Securities Investor Protection Corporation.",none
549,Senate,118,334987,2023-11-20T21:11:52Z,https://api.congress.gov/v3/committee-meeting/118/senate/334987?format=json,"[{'name': 'Senate Commerce, Science, and Transportation', 'systemCode': 'sscm00', 'url': 'https://api.congress.gov/v3/committee/senate/sscm00?format=json'}]",2023-10-18T14:00:00Z,"Business meeting to consider the nominations of Michael G. Whitaker, of Vermont, to be Administrator of the Federal Aviation Administration, Department of Transportation, Rebecca Kelly Slaughter, of Maryland, Melissa Holyoak, of Utah, and Andrew N. Ferguson, of Virginia, each to be a Federal Trade Commissioner, Anthony Rosario Coscia, of New Jersey, Christopher Koos, of Illinois, and Joel Matthew Szabat, of Maryland, each to be a Director of the Amtrak Board of Directors, Douglas Dziak, of Virginia, to be a Commissioner of the Consumer Product Safety Commission, and routine lists in the Coast Guard.",none
550,Senate,118,334921,2023-11-20T21:11:51Z,https://api.congress.gov/v3/committee-meeting/118/senate/334921?format=json,"[{'systemCode': 'ssju26', 'url': 'https://api.congress.gov/v3/committee/senate/ssju26?format=json'}]",2023-10-03T18:30:00Z,"Hearings to examine back to school with the SHOP SAFE Act, focusing on protecting our families from unsafe online counterfeits, including S.2934, to amend the Trademark Act of 1946 to provide for contributory liability for certain electronic commerce platforms for use of a counterfeit mark by a third party on such platforms.",none
551,Senate,118,334852,2023-11-20T21:11:47Z,https://api.congress.gov/v3/committee-meeting/118/senate/334852?format=json,"[{'name': 'Senate Intelligence (Select)', 'systemCode': 'slin00', 'url': 'https://api.congress.gov/v3/committee/senate/slin00?format=json'}]",2023-09-13T18:30:00Z,To receive a closed briefing on certain intelligence matters.,none
552,Senate,118,335018,2023-11-20T21:11:46Z,https://api.congress.gov/v3/committee-meeting/118/senate/335018?format=json,"[{'name': 'Senate Intelligence (Select)', 'systemCode': 'slin00', 'url': 'https://api.congress.gov/v3/committee/senate/slin00?format=json'}]",2023-09-06T18:30:00Z,To receive a closed briefing on certain intelligence matters.,none
553,Senate,118,334741,2023-11-20T21:11:44Z,https://api.congress.gov/v3/committee-meeting/118/senate/334741?format=json,"[{'name': 'Senate Intelligence (Select)', 'systemCode': 'slin00', 'url': 'https://api.congress.gov/v3/committee/senate/slin00?format=json'}]",2023-07-19T18:30:00Z,To receive a closed briefing on certain intelligence matters.,none
554,Senate,118,334481,2023-11-20T21:11:40Z,https://api.congress.gov/v3/committee-meeting/118/senate/334481?format=json,"[{'name': 'Senate Intelligence (Select)', 'systemCode': 'slin00', 'url': 'https://api.congress.gov/v3/committee/senate/slin00?format=json'}]",2023-06-14T18:30:00Z,Closed business meeting to consider pending intelligence matters.,none
555,Senate,118,334345,2023-11-20T21:11:39Z,https://api.congress.gov/v3/committee-meeting/118/senate/334345?format=json,"[{'name': 'Senate Intelligence (Select)', 'systemCode': 'slin00', 'url': 'https://api.congress.gov/v3/committee/senate/slin00?format=json'}]",2023-06-07T18:30:00Z,Closed hearings to examine certain intelligence matters.,none
556,Senate,118,334264,2023-11-20T21:11:38Z,https://api.congress.gov/v3/committee-meeting/118/senate/334264?format=json,"[{'name': 'Senate Intelligence (Select)', 'systemCode': 'slin00', 'url': 'https://api.congress.gov/v3/committee/senate/slin00?format=json'}]",2023-05-31T18:30:00Z,Closed hearings to examine certain intelligence matters.,none
557,Senate,118,334225,2023-11-20T21:11:37Z,https://api.congress.gov/v3/committee-meeting/118/senate/334225?format=json,"[{'name': 'Senate Intelligence (Select)', 'systemCode': 'slin00', 'url': 'https://api.congress.gov/v3/committee/senate/slin00?format=json'}]",2023-05-17T18:30:00Z,Closed hearings to examine certain intelligence matters.,none
558,Senate,118,334139,2023-11-20T21:11:37Z,https://api.congress.gov/v3/committee-meeting/118/senate/334139?format=json,"[{'name': 'Senate Homeland Security and Governmental Affairs', 'systemCode': 'ssga00', 'url': 'https://api.congress.gov/v3/committee/senate/ssga00?format=json'}]",2023-05-17T14:30:00Z,"Business meeting to consider S.285, to provide for the perpetuation, administration, and funding of Federal Executive Boards, S.311, to correct the inequitable denial of enhanced retirement and annuity benefits to certain U.S. Customs and Border Protection Officers, S.1137, to establish the Law Enforcement Mental Health and Wellness Program, S.931, to improve the visibility, accountability, and oversight of agency software asset management practices, S.1524, to ensure that whistleblowers, including contractors, are protected from retaliation when a Federal employee orders a reprisal, S.1528, to streamline the sharing of information among Federal disaster assistance agencies, to expedite the delivery of life-saving assistance to disaster survivors, to speed the recovery of communities from disasters, to protect the security and privacy of information provided by disaster survivors, S.1549, to provide the Congressional Budget Office with necessary authorities to expedite the sharing of data from executive branch agencies, S.885, to establish a Civilian Cybersecurity Reserve in the Department of Homeland Security as a pilot project to address the cybersecurity needs of the United States with respect to national security, S.1425, to require a report on Federal support to the cybersecurity of commercial satellite systems, S.1464, to restrict the flow of illicit drugs into the United States, S.1564, to require the Director of the Office of Personnel Management to establish, or otherwise ensure the provision of, a training program on artificial intelligence for Federal management officials and supervisors, S.1443, to require an interagency strategy for creating a unified posture on counter-unmanned aircraft systems (C-UAS) capabilities and protections at international borders of the United States, S.1510, to amend provisions relating to the Office of the Inspector General of the Government Accountability Office, S.473, to provide for drone security, and S.1560, to require the development of a comprehensive rural hospital cybersecurity workforce development strategy.",none
559,Senate,118,334142,2023-11-20T21:11:37Z,https://api.congress.gov/v3/committee-meeting/118/senate/334142?format=json,"[{'name': 'Senate Judiciary', 'systemCode': 'ssju00', 'url': 'https://api.congress.gov/v3/committee/senate/ssju00?format=json'}]",2023-05-17T14:00:00Z,"Hearings to examine the nominations of Ana de Alba, of California, to be United States Circuit Judge for the Ninth Circuit, and Irma Carrillo Ramirez, of Texas, to be United States Circuit Judge for the Fifth Circuit.",none
560,Senate,118,334133,2023-11-20T21:11:36Z,https://api.congress.gov/v3/committee-meeting/118/senate/334133?format=json,"[{'name': 'Senate Banking, Housing, and Urban Affairs', 'systemCode': 'ssbk00', 'url': 'https://api.congress.gov/v3/committee/senate/ssbk00?format=json'}]",2023-05-16T14:00:00Z,"Hearings to examine the failures of Silicon Valley Bank and Signature Bank, including S.1045, to amend the Federal Deposit Insurance Act to clarify that the Federal Deposit Insurance Corporation and appropriate Federal regulators have the authority to claw back certain compensation paid to executives.",none
