,chamber,congress,eventId,updateDate,url,committees,date,title,witnesses
745,Senate,118,334631,2023-07-19T22:08:15Z,https://api.congress.gov/v3/committee-meeting/118/senate/334631?format=json,"[{'name': 'Senate Homeland Security and Governmental Affairs', 'systemCode': 'ssga00', 'url': 'https://api.congress.gov/v3/committee/senate/ssga00?format=json'}]",2023-07-19T13:30:00Z,"Business meeting to consider S.1253, to increase the number of U.S. Customs and Border Protection Customs and Border Protection officers and support staff and to require reports that identify staffing, infrastructure, and equipment needed to enhance security at ports of entry, S.1444, to increase the pay and enhance the training of United States Border Patrol agents, S.2251, to improve the cybersecurity of the Federal Government, S.2291, to establish the Northern Border Coordination Center, S.2289, to direct the Director of the Information Security Oversight Office to assess foreign influence in the National Industrial Security Program and to develop a single, integrated strategy to better identify and mitigate such foreign influence, S.2278, to establish Image Adjudicator and Supervisory Image Adjudicator positions in the U.S. Customs and Border Protection Office of Field Operations, S.2248, to require a pilot program on the use of big data analytics to identify vessels evading sanctions and export controls and to require a report on the availability in the United States of emerging and foundational technologies subject to export controls, S.2272, to amend title 5, United States Code, to provide for special base rates of pay for wildland firefighters, S.1332, to require the Office of Management and Budget to revise the Standard Occupational Classification system to establish a separate code for direct support professionals, S.2219, to amend the Congressional Accountability Act of 1995 to expand access to breastfeeding accommodations in the workplace, S.2292, to improve the transparency of purchases by the Federal Government of data or information that can be used to identify an individual, S.2286, to improve the effectiveness and performance of certain Federal financial assistance programs, S.1524, to ensure that whistleblowers, including contractors, are protected from retaliation when a Federal employee orders a reprisal, S.2283, to prohibit the procurement of certain items containing perfluorooctane sulfonate (PFOS) or perfluorooctanoic acid (PFOA) and prioritize the procurement of products not containing PFAS, S.2270, to establish and maintain a database within each agency for executive branch ethics records of noncareer appointees, S.2293, to establish the Chief Artificial Intelligence Officers Council, Chief Artificial Intelligence Officers, and Artificial Intelligence Governance Boards, S.2073, to amend title 31, United States Code, to require agencies to include a list of outdated or duplicative reporting requirements in annual budget justifications, S.2032, to require the reduction of the reliance and expenditures of the Federal Government on legacy information technology systems, S.1973, to require the purchase of domestically made flags of the United States of America for use by the Federal Government, S.2256, to authorize the Director of the Cybersecurity and Infrastructure Security Agency to establish an apprenticeship program and to establish a pilot program on cybersecurity training for veterans and members of the Armed Forces transitioning to civilian life, S.2260, to require transparency in notices of funding opportunity, and the nomination of Fara Damelin, of Virginia, to be Inspector General, Federal Communications Commission.",none
746,Senate,118,334627,2023-07-19T20:08:17Z,https://api.congress.gov/v3/committee-meeting/118/senate/334627?format=json,"[{'name': 'Senate Rules and Administration', 'systemCode': 'ssra00', 'url': 'https://api.congress.gov/v3/committee/senate/ssra00?format=json'}]",2023-07-26T19:30:00Z,A joint oversight hearing with the Committee on House Administration to examine the Capitol Police Board.,none
747,Senate,118,334480,2023-07-19T20:08:16Z,https://api.congress.gov/v3/committee-meeting/118/senate/334480?format=json,"[{'systemCode': 'ssap23', 'url': 'https://api.congress.gov/v3/committee/senate/ssap23?format=json'}]",2023-07-19T18:45:00Z,Hearings to examine proposed budget estimates and justification for fiscal year 2024 for the Securities and Exchange Commission.,none
748,Senate,118,333869,2023-07-19T20:08:16Z,https://api.congress.gov/v3/committee-meeting/118/senate/333869?format=json,"[{'name': 'Senate Intelligence (Select)', 'systemCode': 'slin00', 'url': 'https://api.congress.gov/v3/committee/senate/slin00?format=json'}]",2023-07-26T18:00:00Z,Closed business meeting to consider pending intelligence matters; to be immediately followed by a closed briefing on certain intelligence matters.,none
749,Senate,118,334624,2023-07-19T18:08:20Z,https://api.congress.gov/v3/committee-meeting/118/senate/334624?format=json,"[{'name': ""Senate Veterans' Affairs"", 'systemCode': 'ssva00', 'url': 'https://api.congress.gov/v3/committee/senate/ssva00?format=json'}]",2023-07-26T19:00:00Z,Hearings to examine implementing the PACT Act.,none
750,Senate,118,334626,2023-07-19T18:08:20Z,https://api.congress.gov/v3/committee-meeting/118/senate/334626?format=json,"[{'name': 'Senate Budget', 'systemCode': 'ssbu00', 'url': 'https://api.congress.gov/v3/committee/senate/ssbu00?format=json'}]",2023-07-26T13:30:00Z,Hearings to examine the fiscal consequences of climate change on infrastructure.,none
751,Senate,118,334622,2023-07-19T18:08:20Z,https://api.congress.gov/v3/committee-meeting/118/senate/334622?format=json,"[{'systemCode': 'ssju26', 'url': 'https://api.congress.gov/v3/committee/senate/ssju26?format=json'}]",2023-07-26T18:30:00Z,An oversight hearing to examine the United States Patent and Trademark Office.,none
752,Senate,118,334603,2023-07-19T02:08:22Z,https://api.congress.gov/v3/committee-meeting/118/senate/334603?format=json,"[{'systemCode': 'ssbk08', 'url': 'https://api.congress.gov/v3/committee/senate/ssbk08?format=json'}]",2023-07-26T13:30:00Z,Hearings to examine taking account of fees and tactics impacting Americans' wallets.,none
753,Senate,118,334602,2023-07-18T22:23:16Z,https://api.congress.gov/v3/committee-meeting/118/senate/334602?format=json,"[{'systemCode': 'ssju28', 'url': 'https://api.congress.gov/v3/committee/senate/ssju28?format=json'}]",2023-07-25T19:00:00Z,"An oversight hearing to examine artificial intelligence, focusing on principles for regulation.",none
754,Senate,118,334561,2023-07-18T22:23:16Z,https://api.congress.gov/v3/committee-meeting/118/senate/334561?format=json,"[{'name': 'Senate Health, Education, Labor, and Pensions', 'systemCode': 'sshr00', 'url': 'https://api.congress.gov/v3/committee/senate/sshr00?format=json'}]",2023-07-20T14:30:00Z,"Business meeting to consider S.2333, to reauthorize certain programs under the Public Health Service Act with respect to public health security and all-hazards preparedness and response, and other pending calendar business.",none
755,Senate,118,334601,2023-07-18T20:08:18Z,https://api.congress.gov/v3/committee-meeting/118/senate/334601?format=json,"[{'systemCode': 'ssev09', 'url': 'https://api.congress.gov/v3/committee/senate/ssev09?format=json'}]",2023-07-27T13:45:00Z,"Hearings to examine solutions for single-use waste, focusing on expanding refill and reuse infrastructure.",none
756,Senate,118,334521,2023-07-18T20:08:16Z,https://api.congress.gov/v3/committee-meeting/118/senate/334521?format=json,"[{'name': 'Senate Indian Affairs', 'systemCode': 'slia00', 'url': 'https://api.congress.gov/v3/committee/senate/slia00?format=json'}]",2023-07-19T18:30:00Z,"Business meeting to consider S.195, to provide compensation to the Keweenaw Bay Indian Community for the taking without just compensation of land by the United States inside the exterior boundaries of the L'Anse Indian Reservation that were guaranteed to the Community under a treaty signed in 1854, S.382, to take certain land in the State of Washington into trust for the benefit of the Puyallup Tribe of the Puyallup Reservation, S.910, to amend the Grand Ronde Reservation Act, S.1286, to amend the Siletz Reservation Act to address the hunting, fishing, trapping, and animal gathering activities of the Confederated Tribes of Siletz Indians, S.1322, to amend the Act of August 9, 1955, to modify the authorized purposes and term period of tribal leases, S.1987, to provide for the settlement of the water rights claims of the Fort Belknap Indian Community, S.2273, to amend the Indian Child Protection and Family Violence Prevention Act, S.2285, to reauthorize the Native American Housing Assistance and Self-Determination Act of 1996; to be immediately followed by a hearing to examine S.2088, to direct the Secretary of the Interior to complete all actions necessary for certain land to be held in restricted fee status by the Oglala Sioux Tribe and Cheyenne River Sioux Tribe.",none
757,Senate,118,334580,2023-07-14T14:08:44Z,https://api.congress.gov/v3/committee-meeting/118/senate/334580?format=json,"[{'systemCode': 'ssfi10', 'url': 'https://api.congress.gov/v3/committee/senate/ssfi10?format=json'}]",2023-07-20T14:00:00Z,"Hearings to examine the urgent need to reform the U.S. transplant system, focusing on the cost of inaction.",none
758,Senate,118,334582,2023-07-14T14:08:44Z,https://api.congress.gov/v3/committee-meeting/118/senate/334582?format=json,"[{'name': 'Senate Banking, Housing, and Urban Affairs', 'systemCode': 'ssbk00', 'url': 'https://api.congress.gov/v3/committee/senate/ssbk00?format=json'}]",2023-07-20T14:00:00Z,Hearings to examine perspectives on deposit insurance reform after recent bank failures.,none
759,Senate,118,334581,2023-07-14T14:08:44Z,https://api.congress.gov/v3/committee-meeting/118/senate/334581?format=json,"[{'systemCode': 'sscm36', 'url': 'https://api.congress.gov/v3/committee/senate/sscm36?format=json'}]",2023-07-20T13:30:00Z,An oversight hearing to examine the National Oceanic and Atmospheric Administration budget.,none
760,Senate,118,334566,2023-07-13T22:08:20Z,https://api.congress.gov/v3/committee-meeting/118/senate/334566?format=json,"[{'name': 'Senate Judiciary', 'systemCode': 'ssju00', 'url': 'https://api.congress.gov/v3/committee/senate/ssju00?format=json'}]",2023-07-20T13:30:00Z,"Business meeting to consider S.359, to amend title 28, United States Code, to provide for a code of conduct for justices of the Supreme Court of the United States, and the nomination of Julia Kathleen Munley, to be United States District Judge for the Middle District of Pennsylvania.",none
761,Senate,118,334562,2023-07-13T22:08:20Z,https://api.congress.gov/v3/committee-meeting/118/senate/334562?format=json,"[{'name': 'Senate Armed Services', 'systemCode': 'ssas00', 'url': 'https://api.congress.gov/v3/committee/senate/ssas00?format=json'}]",2023-07-20T13:00:00Z,"Hearings to examine the nomination of Lieutenant General Timothy D. Haugh, USAF, to be general and Director, National Security Agency/Chief, Central Security Service Commander, United States Cyber Command.",none
762,Senate,118,334441,2023-07-13T22:08:19Z,https://api.congress.gov/v3/committee-meeting/118/senate/334441?format=json,"[{'systemCode': 'sseg07', 'url': 'https://api.congress.gov/v3/committee/senate/sseg07?format=json'}]",2023-07-19T18:30:00Z,"An oversight hearing to examine of the Bureau of Reclamation, including S.461, to make certain irrigation districts eligible for Pick-Sloan Missouri Basin Program pumping power, S.482, to amend the Klamath Basin Water Supply Enhancement Act of 2000 to provide the Secretary of the Interior with certain authorities with respect to projects affecting the Klamath Basin watershed, S.739, to clarify jurisdiction with respect to certain Bureau of Reclamation pumped storage development, S.1118, to establish the Open Access Evapotranspiration (OpenET) Data Program, S.1215, to require assessments of opportunities to install and maintain floating photovoltaic solar panels at Bureau of Reclamation and Corps of Engineers projects, S.1521, to amend the Federal Power Act to modernize and improve the licensing of non-Federal hydropower projects, S.1662, to direct the Secretary of the Interior to convey to the Midvale Irrigation District the Pilot Butte Power Plant in the State of Wyoming, S.1955, to amend the Central Utah Project Completion Act to authorize expenditures for the conduct of certain water conservation measures in the Great Salt Lake basin, S.2102, to provide for drought preparedness and improved water supply reliability, S.2160, to amend the Omnibus Public Land Management Act of 2009 to authorize certain extraordinary operation and maintenance work for urban canals of concern, S.2161, to provide financial assistance for projects to address certain subsidence impacts in the State of California, S.2162, to support water infrastructure in Reclamation States, S.2166, to amend the Reclamation States Emergency Drought Relief Act of 1991 and the Omnibus Public Land Management Act of 2009 to provide grants to States and Indian Tribes for programs to voluntarily repurpose agricultural land to reduce consumptive water use, S.2169, to authorize the Secretary of the Interior to carry out watershed pilots, S.2202, to amend the Omnibus Public Land Management Act of 2009 to authorize the modification of transferred works to increase public benefits and other project benefits as part of extraordinary operation and maintenance work, and S.2247, to reauthorize the Bureau of Reclamation to provide cost-shared funding to implement the endangered and threatened fish recovery programs for the Upper Colorado and San Juan River Basins.",none
763,Senate,118,334564,2023-07-13T20:08:21Z,https://api.congress.gov/v3/committee-meeting/118/senate/334564?format=json,"[{'name': 'Senate Aging (Special)', 'systemCode': 'spag00', 'url': 'https://api.congress.gov/v3/committee/senate/spag00?format=json'}]",2023-07-20T13:30:00Z,Hearings to examine housing accessibility and affordability for older adults and people with disabilities.,none
764,Senate,118,334460,2023-07-13T14:08:17Z,https://api.congress.gov/v3/committee-meeting/118/senate/334460?format=json,"[{'name': ""Senate Veterans' Affairs"", 'systemCode': 'ssva00', 'url': 'https://api.congress.gov/v3/committee/senate/ssva00?format=json'}]",2023-07-13T16:05:00Z,"Business meeting to consider the nomination of Tanya J. Bradsher, of Virginia, to be Deputy Secretary of Veterans Affairs.",none
765,Senate,118,334542,2023-07-13T00:08:19Z,https://api.congress.gov/v3/committee-meeting/118/senate/334542?format=json,"[{'systemCode': 'ssju01', 'url': 'https://api.congress.gov/v3/committee/senate/ssju01?format=json'}]",2023-07-19T18:45:00Z,Hearings to examine trends in vertical merger enforcement.,none
766,Senate,118,334360,2023-07-12T22:08:19Z,https://api.congress.gov/v3/committee-meeting/118/senate/334360?format=json,"[{'name': 'Senate Foreign Relations', 'systemCode': 'ssfr00', 'url': 'https://api.congress.gov/v3/committee/senate/ssfr00?format=json'}]",2023-07-13T14:30:00Z,"Business meeting to consider S.2043, to provide for certain authorities of the Department of State, S.1457, to authorize negotiation and conclusion and to provide for congressional consideration of a tax agreement between the American Institute in Taiwan (AIT) and the Taipei Economic and Cultural Representative Office (TECRO), S.1203, to amend the Peace Corps Act by reauthorizing the Peace Corps, providing better support for current, returning, and former volunteers, S.847, to establish the International Children with Disabilities Protection Program within the Department of State, S.2006, to foster Tunisia's democratic institutions, to limit funds until Tunisia restores checks and balances, and to authorize the creation of a fund to support democratic reforms, S.416, to designate the Russian-based mercenary Wagner Group as a foreign terrorist organization, S.490, to require the President to remove the extension of certain privileges, exemptions, and immunities to the Hong Kong Economic and Trade Offices if Hong Kong no longer enjoys a high degree of autonomy from the People's Republic of China, S.Con.Res.2, commending the bravery, courage, and resolve of the women and men of Iran demonstrating in more than 133 cities and risking their safety to speak out against the Iranian regime's human rights abuses, S.Res.20, condemning the coup that took place on February 1, 2021, in Burma and the Burmese military's detention of civilian leaders, calling for an immediate and unconditional release of all those detained, promoting accountability and justice for those killed by the Burmese military, and calling for those elected to serve in parliament to resume their duties without impediment, S.Res.75, reaffirming the state of Arunachal Pradesh as Indian territory and condemning the People's Republic of China's provocations in South Asia, and the nominations of Richard Mills, Jr., of Georgia, to be Ambassador to the Federal Republic of Nigeria, Department of State, Nisha Desai Biswal, of Virginia, to be Deputy Chief Executive Officer of the United States International Development Finance Corporation, and Gerald H. Acker, of Michigan, to be a Commissioner on the part of the United States on the International Joint Commission, United States and Canada, and Kara C. McDonald, of Virginia, to be Ambassador to the Republic of Lithuania, Jack A. Markell, of Delaware, to be Ambassador to the Italian Republic, and to serve concurrently and without additional compensation as Ambassador to the Republic of San Marino, Dorothy Camille Shea, of North Carolina, to be the Deputy Representative of the United States of America to the United Nations, with the rank and status of Ambassador and the Deputy Representative of the United States of America in the Security Council of the United Nations, and to be Representative of the United States of America to the Sessions of the General Assembly of the United Nations, during her tenure of service as Deputy Representative of the United States of America to the United Nations, Vernelle Trim FitzPatrick, of Virginia, to be Ambassador to the Gabonese Republic, Lisa Peterson, of Virginia, to be Ambassador to the Republic of Burundi, Joel Ehrendreich, of New York, to be Ambassador to the Republic of Palau, Cynthia Kierscht, of Minnesota, to be Ambassador to the Republic of Djibouti, and Edgard D. Kagan, of Virginia, to be Ambassador to Malaysia, all of the Department of State.",none
767,Senate,118,334522,2023-07-12T20:08:21Z,https://api.congress.gov/v3/committee-meeting/118/senate/334522?format=json,"[{'systemCode': 'ssaf15', 'url': 'https://api.congress.gov/v3/committee/senate/ssaf15?format=json'}]",2023-07-19T19:00:00Z,"Hearings to examine rural water, focusing on modernizing our community water systems.",none
768,Senate,118,334347,2023-07-12T20:08:20Z,https://api.congress.gov/v3/committee-meeting/118/senate/334347?format=json,"[{'name': 'Senate Health, Education, Labor, and Pensions', 'systemCode': 'sshr00', 'url': 'https://api.congress.gov/v3/committee/senate/sshr00?format=json'}]",2023-07-12T21:00:00Z,"Business meeting to consider the nominations of Gwynne A. Wilcox, of New York, to be a Member of the National Labor Relations Board, Loren E. Sweatt, of Virginia, to be a Member of the National Mediation Board, and other pending calendar business.",none
769,Senate,118,334380,2023-07-12T20:08:19Z,https://api.congress.gov/v3/committee-meeting/118/senate/334380?format=json,"[{'systemCode': 'sseg03', 'url': 'https://api.congress.gov/v3/committee/senate/sseg03?format=json'}]",2023-07-12T18:30:00Z,"Hearings to examine S.636, to establish the Dolores River National Conservation Area and the Dolores River Special Management Area in the State of Colorado, to protect private water rights in the State, S.912, to require the Secretary of Energy to provide technology grants to strengthen domestic mining education, S.1015, to require the Secretary of Agriculture to convey the Pleasant Valley Ranger District Administrative Site to Gila County, Arizona, S.1088, to authorize the relinquishment and in lieu selection of land and minerals in the State of North Dakota, to restore land and minerals to Indian Tribes within the State of North Dakota, S.1254, to designate and expand wilderness areas in Olympic National Forest in the State of Washington, and to designate certain rivers in Olympic National Forest and Olympic National Park as wild and scenic rivers, S.1405, to provide for the exchange of certain Federal land and State land in the State of Utah, S.1622, to discourage speculative oil and gas leasing and to promote enhanced multiple use management of public land and National Forest System land, S.1634, to provide for the designation of certain wilderness areas, recreation management areas, and conservation areas in the State of Colorado, S.1657, to authorize the Secretary of the Interior to convey certain land to La Paz County, Arizona, S.1760, to amend the Apex Project, Nevada Land Transfer and Authorization Act of 1989 to include the city of North Las Vegas, Nevada, and the Apex Industrial Park Owners Association, S.1776, to provide for the protection of and investment in certain Federal land in the State of California, S.1890, to provide for the establishment of a grazing management program on Federal land in Malheur County, Oregon, S.2020, to amend the Oregon Resource Conservation Act of 1996 to reauthorize the Deschutes River Conservancy Working Group, S.2042, to amend the Sloan Canyon National Conservation Area Act to adjust the boundary of the Sloan Canyon National Conservation Area, S.2136, to require the Secretary of the Interior and the Secretary of Agriculture to convey certain Federal land to the State of Utah for inclusion in certain State parks, S.2149, to sustain economic development and recreational use of National Forest System land in the State of Montana, to add certain land to the National Wilderness Preservation System, to designate new areas for recreation, and S.2216, to release from wilderness study area designation certain land in the State of Montana, to improve the management of that land.",none
770,Senate,118,334422,2023-07-12T16:08:20Z,https://api.congress.gov/v3/committee-meeting/118/senate/334422?format=json,"[{'name': ""Senate Veterans' Affairs"", 'systemCode': 'ssva00', 'url': 'https://api.congress.gov/v3/committee/senate/ssva00?format=json'}]",2023-07-12T19:00:00Z,"Hearings to examine S.449, to amend title 38, United States Code, to improve the assignment of patient advocates at medical facilities of the Department of Veterans Affairs, S.495, to require the Secretary of Veterans Affairs to carry out a pilot program to provide assisted living services for eligible veterans, S.853, to direct the Secretary of Veterans Affairs to establish the Zero Suicide Initiative pilot program of the Department of Veterans Affairs, S.928, to require the Secretary of Veterans Affairs to prepare an annual report on suicide prevention, S.1037, to prohibit the Secretary of Veterans Affairs from carrying out certain activities under the Electronic Health Record Modernization Program until certification of system stability improvements, S.1040, to amend title 38, United States Code, to prohibit smoking on the premises of any facility of the Veterans Health Administration, S.1125, to authorize an electronic health record modernization program of the Department of Veterans Affairs and increase oversight and accountability of the program to better serve veterans, medical professionals of the Department, and taxpayers, S.1172, to amend title 28, United States Code, to make certain improvements relating to the eligibility of veterans to receive reimbursement for emergency treatment furnished to veterans in non-Department of Veterans Affairs facilities, S.1315, to improve the provision of care and services under the Veterans Community Care Program of the Department of Veterans Affairs, S.1436, to expand and extend benefits available to veterans in response to the COVID-19 pandemic, S.1545, to direct the Secretary of Veterans Affairs to carry out a pilot program to improve the ability of veterans to access medical care in medical facilities of the Department of Veterans Affairs and in the community by providing veterans the ability to choose health care providers, S.1612, to require the Secretary of Veterans Affairs to publish a rule to implement the requirement that the Secretary be permitted to waive the limitation in law on reimbursement of veterans receiving domiciliary care in State homes, S.1828, to amend title 38, United States Code, to direct the Secretary of Veterans Affairs to recognize nurse registries for purposes of the Veterans Community Care Program, S.1951, to amend title 38, United States Code, to expand entitlement of veterans to care from the Department of Veterans Affairs and to guarantee health care benefits for veterans enrolled in the patient enrollment system of the Department, S.1954, to improve the provision of health care furnished by the Department of Veterans Affairs for veterans diagnosed with diabetes and heart disease, S.2067, to require the Secretary of Veterans Affairs to award grants to nonprofit organizations to assist such organizations in carrying out programs to provide service dogs to eligible veterans, an original bill entitled, ""Making Community Care Work for Veterans Act"", an original bill entitled, ""Leveraging Integrated Networks in Communities for Veterans Act"", and an original bill entitled, ""Rural Vital Emergency Transportation Services Act"".",none
