,chamber,congress,eventId,updateDate,url,committees,date,title,witnesses
959,Senate,118,334014,2023-04-13T22:08:12Z,https://api.congress.gov/v3/committee-meeting/118/senate/334014?format=json,"[{'name': 'Senate Energy and Natural Resources', 'systemCode': 'sseg00', 'url': 'https://api.congress.gov/v3/committee/senate/sseg00?format=json'}]",2023-04-20T14:00:00Z,Hearings to examine the President's proposed budget request for fiscal year 2024 for the Department of Energy.,none
961,Senate,118,334008,2023-04-13T22:08:11Z,https://api.congress.gov/v3/committee-meeting/118/senate/334008?format=json,"[{'name': 'Senate Energy and Natural Resources', 'systemCode': 'sseg00', 'url': 'https://api.congress.gov/v3/committee/senate/sseg00?format=json'}]",2023-04-18T14:00:00Z,Hearings to examine the President's proposed budget request for fiscal year 2024 for the United States Forest Service.,none
965,Senate,118,333994,2023-04-12T02:08:12Z,https://api.congress.gov/v3/committee-meeting/118/senate/333994?format=json,"[{'name': 'Senate Energy and Natural Resources', 'systemCode': 'sseg00', 'url': 'https://api.congress.gov/v3/committee/senate/sseg00?format=json'}]",2023-04-18T14:00:00Z,Hearings to examine the President's proposed budget request for fiscal year 2024 for the United States Forest Service.,none
975,Senate,118,333943,2023-03-27T20:08:12Z,https://api.congress.gov/v3/committee-meeting/118/senate/333943?format=json,"[{'name': 'Senate Environment and Public Works', 'systemCode': 'ssev00', 'url': 'https://api.congress.gov/v3/committee/senate/ssev00?format=json'}]",2023-05-03T14:00:00Z,Hearings to examine the 2024 U.S. Army Corps of Engineers budget and implementation of Water Resources Development Act of 2022.,none
984,Senate,118,333841,2023-03-23T16:08:14Z,https://api.congress.gov/v3/committee-meeting/118/senate/333841?format=json,"[{'name': 'Senate Energy and Natural Resources', 'systemCode': 'sseg00', 'url': 'https://api.congress.gov/v3/committee/senate/sseg00?format=json'}]",2023-03-23T14:00:00Z,Business meeting to consider subcommittee assignments for the 118th Congress; to be immediately followed by a hearing to examine the steps needed to address the cybersecurity vulnerabilities in the United States' energy infrastructure.,none
995,Senate,118,333903,2023-03-21T20:08:17Z,https://api.congress.gov/v3/committee-meeting/118/senate/333903?format=json,"[{'name': 'Senate Environment and Public Works', 'systemCode': 'ssev00', 'url': 'https://api.congress.gov/v3/committee/senate/ssev00?format=json'}]",2023-03-29T14:00:00Z,"Hearings to examine the EPA Good Neighbor rule, focusing on healthier air for downwind states.",none
